{
  "dataset_version": "moex_approved_universe_current_v1",
  "roll_policy_version": "front_liquidity_oi_v1",
  "adjustment_policy_version": "backward_current_anchor_additive_v1",
  "instrument_id": "BR",
  "timeframe": "15m",
  "ts": "2026-03-16T09:15:00Z",
  "active_contract_id": "BR-7.26",
  "previous_contract_id": "BR-6.26",
  "candidate_contract_id": "BR-7.26",
  "roll_epoch": 1,
  "roll_event_id": "CFR-moex_approved_universe_current_v1-BR-15m-0001",
  "is_roll_bar": true,
  "is_first_bar_after_roll": true,
  "bars_since_roll": 0,
  "native_open": 84.5,
  "native_high": 85.0,
  "native_low": 84.0,
  "native_close": 84.8,
  "native_volume": 1200,
  "native_open_interest": null,
  "continuous_open": 84.5,
  "continuous_high": 85.0,
  "continuous_low": 84.0,
  "continuous_close": 84.8,
  "adjustment_mode": "additive",
  "cumulative_additive_offset": 0.0,
  "ratio_factor": null,
  "price_space": "continuous_backward_current_anchor_additive",
  "causality_watermark_ts": "2026-03-16T09:00:00Z",
  "input_row_count": 4,
  "created_at": "2026-04-28T00:00:00Z"
}
